<?xml version="1.0" encoding="UTF-8"?>
<!DOCTYPE configuration SYSTEM "module.dtd">



<!-- This program is free software; you can redistribute it and/or modify -->
<!-- it under the terms of the GNU General Public License as published by -->
<!-- the Free Software Foundation; either version 2 of the License, or -->
<!-- (at your option) any later version. -->
    
<!-- This program is distributed in the hope that it will be useful, -->
<!-- but WITHOUT ANY WARRANTY; without even the implied warranty of -->
<!-- MERCHANTABILITY or FITNESS FOR A PARTICULAR PURPOSE.  See the -->
<!-- GNU General Public License for more details. -->
    
<!-- You should have received a copy of the GNU General Public License -->
<!-- along with this program; if not, write to the Free Software -->
<!-- Foundation, Inc., 59 Temple Place, Suite 330, Boston, MA  02111-1307 USA -->



<!-- This file configures and loads the Cinema Menu system. I have -->
<!-- placed this separately because its a fairly long and complex -->
<!-- configuration, and it just complicates the main system. -->

<configuration>
  
  <!-- Configure the menu system -->
  <module>
    <name>CINEMA_MENU_SYSTEM</name>
    <config>
      <tree>
        <!-- The File Menu -->
        <node>
          <value>File</value>
          <node>
            <!-- Provides the save alignment -->
            <name>XMFA_MODEL_OUTPUT</name>
          </node>
          <node>
            <!-- Provides the exit menu -->
            <name>CINEMA_CORE_GUI</name>
          </node>
        </node>
        <!-- End File Menu -->
        
        <!-- The Edit Menu -->
        <node>
          <value>Edit</value>
<!--TODO: Either remove permanently or restore (commented out to remove Motif stuff) -->
<!--          
          <node>
            <name>CINEMA_MOTIF</name>
          </node>
-->
          <node>
            <name>CINEMA_REGEXP</name>
          </node>
        </node>
        <!-- End View Menu -->

        <node>
          <value>View</value>
          <node>
            <!-- Provides the ability to resize the elements of the
            viewer -->
            <name>CINEMA_RESIZE_ELEMENTS</name>
	  </node>
        </node>
        
        <!-- The Colour Menu -->
        <node>
          <value>Colour</value>
          <node>
            <name>CINEMA_COLOR_SELECTOR</name>
          </node>
        </node>
        <!-- End Colour Menu -->
        
        <!-- The Group Menu -->
        <node>
          <value>Group</value>
          <node>
            <!-- Provides the group frame -->
            <name>CINEMA_GROUPS</name>
          </node>
        </node>
        <!-- End Group Menu -->

        <!-- The Consensus Menu -->
        <node>
          <value>Consensus</value>
          <node>
            <name>CINEMA_CONSENSUS_DISPLAY</name>
          </node>
        </node>
      </tree>
    </config>
  </module>
	
  
  <!-- Read the menu hook to enable addition of more configuration by
  the user -->
  <read required='false'>menu-hook.xml</read>
  
  <!-- Add in Menu system -->
  <load>
    <name>CINEMA_MENU_SYSTEM</name>
  </load>
  <start>
    <name>CINEMA_MENU_SYSTEM</name>
  </start>
  
</configuration>


