<?xml version="1.0" encoding="UTF-8"?>
<!DOCTYPE configuration SYSTEM "module.dtd">



<!-- This program is free software; you can redistribute it and/or modify -->
<!-- it under the terms of the GNU General Public License as published by -->
<!-- the Free Software Foundation; either version 2 of the License, or -->
<!-- (at your option) any later version. -->
    
<!-- This program is distributed in the hope that it will be useful, -->
<!-- but WITHOUT ANY WARRANTY; without even the implied warranty of -->
<!-- MERCHANTABILITY or FITNESS FOR A PARTICULAR PURPOSE.  See the -->
<!-- GNU General Public License for more details. -->
    
<!-- You should have received a copy of the GNU General Public License -->
<!-- along with this program; if not, write to the Free Software -->
<!-- Foundation, Inc., 59 Temple Place, Suite 330, Boston, MA  02111-1307 USA -->



<!-- There are modules that do lots of calculations to produce their -->
<!-- results. -->

<configuration>
  
  <module>
    <name>CINEMA_MULTIPLE_CONSENSUS</name>
    <config>
      <tree>
        <node>
          <value>Options</value>
          <node>
            <name>CINEMA_COLOR_SELECTOR</name>
          </node>
          <node>
            <name>CINEMA_RESIZE_ELEMENTS</name>
          </node>
        </node>
      </tree>
    </config>
  </module>
  

  <!-- Configure the consensus calculation module -->
  <module>
    <name>CINEMA_CONSENSUS</name>
    <config>
      <properties>
        <param>
          <paramname>uk.ac.man.bioinf.apps.cinema.consensus.PercentageIDConsensusCalculatorMetaData</paramname>
          <value></value>
        </param>
        <param>
          <paramname>uk.ac.man.bioinf.apps.cinema.consensus.ThreadedPercentageIDConsensusCalculatorMetaData</paramname>
          <value>default</value>
        </param>
      </properties>
    </config>
  </module>

  <!-- Now load the consensus display module -->
  <load>
    <name>CINEMA_CONSENSUS_DISPLAY</name>
  </load>
  <start>
    <name>CINEMA_CONSENSUS_DISPLAY</name>
  </start>
</configuration>